Id,IndicatorCode,SpatialDimension,SpatialDimensionValueCode,ParentLocationCode,ParentLocation,TimeDimension,TimeDim,DisaggregatingDimension1,DisaggregatingDimension1ValueCode,DisaggregatingDimension2,DisaggregatingDimension2ValueCode,DisaggregatingDimension3,DisaggregatingDimension3ValueCode,DataSourceDimension,DataSourceDimensionValueCode,Value,NumericValue,Low,High,Comments,Date,TimeDimensionValue,TimeDimensionBegin,TimeDimensionEnd
2718610,MDG_0000000025,COUNTRY,CMR,AFR,Africa,YEAR,2004,,,,,,,,,59,59,,," Institut National de la Statistique (INS) et ORC Macro. Enquête Démographique et de Santé du Cameroun 2004. Calverton, Maryland, USA: INS et ORC Macro; 2005 (in French).",2025-04-07T06:46:44Z,2004,2004-01-01,2004-12-31
2723102,MDG_0000000025,COUNTRY,SWZ,AFR,Africa,YEAR,2007,,,,,,,,,69,69,,," Central Statistical Office (CSO) [Swaziland], Macro International Inc. Swaziland Demographic and Health Survey 2006-07. Mbabane, Swaziland: Central Statistical Office, Macro International Inc.; 2008.",2025-04-07T06:46:44Z,2006-2007,2006-01-01,2007-12-31
2728748,MDG_0000000025,COUNTRY,GEO,EUR,Europe,YEAR,2003,,,,,,,,,97,97,,," Health Care, Statistical Yearbook 2011 Georgia. Tbilisi: Ministry of Labour, Health and Social Affairs of Georgia, National Centre for Disease Control and Public Health; 2012.",2025-04-07T06:46:44Z,2003,2003-01-01,2003-12-31
2738244,MDG_0000000025,COUNTRY,HUN,EUR,Europe,YEAR,2006,,,,,,,,,100,100,,,"Skilled health personnel Transformative Monitoring for Enhanced Equity (TransMonEE) 2012 Database [online database]. Geneva: UNICEF Europe and Central Asia Regional Office; 2012 (www.transmonee.org, accessed 1 November 2012). ",2025-04-07T06:46:44Z,2006,2006-01-01,2006-12-31
2739594,MDG_0000000025,COUNTRY,ISR,EUR,Europe,YEAR,2022,,,,,,,,,100,100,,, Israel Medical Birth Registry. Institutional Delivery. Israel Central Bureau of Statistics; 2023. Country Consultation 2024,2025-04-07T06:46:44Z,2022,2022-01-01,2022-12-31
2740744,MDG_0000000025,COUNTRY,ECU,AMR,Americas,YEAR,2003,,,,,,,,,75,75,,,"Doctors, obstetrician and nurse Estadísticas Vitales: Registro Estadístico de Nacidos Vivos y Defunciones 2020. Quito: Instituto Nacional de Estadística y Censos (INEC); 2021 (in Spanish). ",2025-04-07T06:46:44Z,2003,2003-01-01,2003-12-31
2747149,MDG_0000000025,COUNTRY,SLV,AMR,Americas,YEAR,2015,,,,,,,,,100,100,,, Informe de Labores 2016-2017. San Salvador: Ministerio de Salud de El Salvador; 2017 (in Spanish).,2025-04-07T06:46:44Z,2015,2015-01-01,2015-12-31
2753655,MDG_0000000025,COUNTRY,USA,AMR,Americas,YEAR,2017,,,,,,,,,99,99,,," Martin JA, Hamilton BE, Osterman MJK, Driscoll AK, Drake P. Births: Final Data for 2017. National Vital Statistics Reports; vol 67, no 8. Hyattsville, MD: National Center for Health Statistics; 2018.",2025-04-07T06:46:44Z,2017,2017-01-01,2017-12-31
2758039,MDG_0000000025,COUNTRY,MDV,SEAR,South-East Asia,YEAR,2014,,,,,,,,,96,96,,, The Maldives Health Statistics 2014. Malé: Ministry of Health [Republic of Maldives]; 2017.,2025-04-07T06:46:44Z,2014,2014-01-01,2014-12-31
2769347,MDG_0000000025,COUNTRY,CHL,AMR,Americas,YEAR,2020,,,,,,,,,100,100,,,"Skilled health personnel PLISA Health Information Platform. Indicator profile: Deliveries attended by skilled birth attendants (%) [online database]. Washington, DC: Pan American Health Organization/World Health Organization (PAHO/WHO); 2023 (https://opendata.paho.org/es/indicadores-basicos/tablero-de-los-indicadores-basicos, accessed 21 September 2023). ",2025-04-07T06:46:44Z,2020,2020-01-01,2020-12-31
2771729,MDG_0000000025,COUNTRY,POL,EUR,Europe,YEAR,2012,,,,,,,,,100,100,,," Statistics Poland (GUS) [Website]. Warsaw: Statistics Poland (GUS); 2020 (https://sdg.gov.pl/en/statistics_glob/3-1-2/, accessed 28 February 2021).",2025-04-07T06:46:44Z,2012,2012-01-01,2012-12-31
2771819,MDG_0000000025,COUNTRY,BHS,AMR,Americas,YEAR,2009,,,,,,,,,99,99,,,"Trained personnel PLISA Health Information Platform. Indicator profile: Deliveries attended by skilled birth attendants (%) [online database]. Washington, DC: Pan American Health Organization/World Health Organization (PAHO/WHO); 2021 (https://opendata.paho.org/es/indicadores-basicos/tablero-de-los-indicadores-basicos, accessed 30 December 2021). ",2025-04-07T06:46:44Z,2009,2009-01-01,2009-12-31
2775697,MDG_0000000025,COUNTRY,RUS,EUR,Europe,YEAR,2008,,,,,,,,,100,100,,,"Skilled health personnel Transformative Monitoring for Enhanced Equity (TransMonEE) 2012 Database [online database]. Geneva: UNICEF Europe and Central Asia Regional Office; 2012 (www.transmonee.org, accessed 1 November 2012). ",2025-04-07T06:46:44Z,2008,2008-01-01,2008-12-31
2795032,MDG_0000000025,COUNTRY,MSR,AMR,Americas,YEAR,2010,,,,,,,,,100,100,,,"Trained personnel PLISA Health Information Platform. Indicator profile: Deliveries attended by skilled birth attendants (%) [online database]. Washington, DC: Pan American Health Organization/World Health Organization (PAHO/WHO); 2021 (https://opendata.paho.org/es/indicadores-basicos/tablero-de-los-indicadores-basicos, accessed 30 December 2021). ",2025-04-07T06:46:44Z,2010,2010-01-01,2010-12-31
2797547,MDG_0000000025,COUNTRY,LCA,AMR,Americas,YEAR,2014,,,,,,,,,99,99,,,"Trained personnel PLISA Health Information Platform. Indicator profile: Deliveries attended by skilled birth attendants (%) [online database]. Washington, DC: Pan American Health Organization/World Health Organization (PAHO/WHO); 2018 (http://www.paho.org/data/index.php/en/indicators/visualization.html, accessed 11 February 2020). ",2025-04-07T06:46:44Z,2014,2014-01-01,2014-12-31
2801846,MDG_0000000025,COUNTRY,ZWE,AFR,Africa,YEAR,2014,,,,,,,,,80,80,,," Zimbabwe National Statistics Agency (ZIMSTAT), United Nations Children's Fund (UNICEF), United Nations Population Fund (UNFPA), United Nations Development Programme (UNDP), USAID. Zimbabwe Multiple Indicator Cluster Survey 2014, Final Report. Harare, Zimbabwe: ZIMSTAT, UNICEF, UNFPA, UNDP, USAID; 2015.",2025-04-07T06:46:44Z,2014,2014-01-01,2014-12-31
2803204,MDG_0000000025,COUNTRY,KNA,AMR,Americas,YEAR,2014,,,,,,,,,100,100,,,"Trained personnel PLISA Health Information Platform. Indicator profile: Deliveries attended by skilled birth attendants (%) [online database]. Washington, DC: Pan American Health Organization/World Health Organization (PAHO/WHO); 2021 (https://opendata.paho.org/es/indicadores-basicos/tablero-de-los-indicadores-basicos, accessed 30 December 2021). ",2025-04-07T06:46:44Z,2014,2014-01-01,2014-12-31
2812438,MDG_0000000025,COUNTRY,COL,AMR,Americas,YEAR,2022,,,,,,,,,98,98,,,Skilled health personnel DANE. Estadísticas Vitales - Nacimientos 2022; partos atendidos por médico o enfermero(a). Bogotá D.C.: Departamento Administrativo Nacional de Estadística (DANE); 2022.,2025-04-07T06:46:44Z,2022,2022-01-01,2022-12-31
2820345,MDG_0000000025,COUNTRY,MNE,EUR,Europe,YEAR,2000,,,,,,,,,99,99,,,"Skilled health personnel Transformative Monitoring for Enhanced Equity (TransMonEE) 2012 Database [online database]. Geneva: UNICEF Europe and Central Asia Regional Office; 2012 (www.transmonee.org, accessed 1 November 2012). ",2025-04-07T06:46:44Z,2000,2000-01-01,2000-12-31
2820982,MDG_0000000025,COUNTRY,MEX,AMR,Americas,YEAR,2004,,,,,,,,,90,90,,," SS. Dirección General de Información en Salud (DGIS) [Mexico]; 2020. (http://www.agenda2030.mx/ODSind.html?ind=ODS003000030020&cveind=27&cveCob=99&lang=es#/Indicator, last accessed 28 January 2021)",2025-04-07T06:46:44Z,2004,2004-01-01,2004-12-31
2824883,MDG_0000000025,COUNTRY,USA,AMR,Americas,YEAR,2006,,,,,,,,,99,99,,," Martin JA, Hamilton BE, Sutton PD, Ventura SJ, Menacker F, Kirmeyer S et al. Births: Final data for 2006. National Vital Statistics Reports; vol.57, no. 7. Hyattsville, MD: National Center for Health Statistics; 2009.",2025-04-07T06:46:44Z,2006,2006-01-01,2006-12-31
2827139,MDG_0000000025,COUNTRY,MEX,AMR,Americas,YEAR,2001,,,,,,,,,88,88,,," SS. Dirección General de Información en Salud (DGIS) [Mexico]; 2020. (http://www.agenda2030.mx/ODSind.html?ind=ODS003000030020&cveind=27&cveCob=99&lang=es#/Indicator, last accessed 28 January 2021)",2025-04-07T06:46:44Z,2001,2001-01-01,2001-12-31
2834666,MDG_0000000025,COUNTRY,CAN,AMR,Americas,YEAR,2019,,,,,,,,,98,98,,," Statistics Canada. Table 13-10-0429-01  Live births and fetal deaths (stillbirths), by place of birth (hospital or non-hospital). Canada; 2023. DOI: https://doi.org/10.25318/1310042901-eng",2025-04-07T06:46:44Z,2019,2019-01-01,2019-12-31
2835274,MDG_0000000025,GLOBAL,GLOBAL,,,YEAR,2005,,,,,,,,,64,64,,,,2024-04-26T13:59:03Z,2005,2005-01-01,2005-12-31
2835739,MDG_0000000025,COUNTRY,SVK,EUR,Europe,YEAR,2010,,,,,,,,,99,99,,,"Skilled health personnel Transformative Monitoring for Enhanced Equity (TransMonEE) 2012 Database [online database]. Geneva: UNICEF Europe and Central Asia Regional Office; 2012 (www.transmonee.org, accessed 1 November 2012). ",2025-04-07T06:46:44Z,2010,2010-01-01,2010-12-31
2836405,MDG_0000000025,COUNTRY,MKD,EUR,Europe,YEAR,2018,,,,,,,,,100,100,,,Health personnel Statistical Yearbook of the Republic of Macedonia 2019. Skopje: State Statistical Office [Macedonia]; 2019.,2025-04-07T06:46:44Z,2018,2018-01-01,2018-12-31
2839411,MDG_0000000025,COUNTRY,RUS,EUR,Europe,YEAR,2002,,,,,,,,,99,99,,,"Skilled health personnel Transformative Monitoring for Enhanced Equity (TransMonEE) 2012 Database [online database]. Geneva: UNICEF Europe and Central Asia Regional Office; 2012 (www.transmonee.org, accessed 1 November 2012). ",2025-04-07T06:46:44Z,2002,2002-01-01,2002-12-31
2841057,MDG_0000000025,REGION,EMR,,,YEAR,2016,,,,,,,,,74,74,,,,2024-04-26T13:59:03Z,2016,2016-01-01,2016-12-31
2856352,MDG_0000000025,COUNTRY,POL,EUR,Europe,YEAR,2007,,,,,,,,,99,99,,, Demographic Yearbook of Poland 2009 - Branch Yearbooks. Warsaw: Central Statistical Office [Poland]; 2009.,2025-04-07T06:46:44Z,2007,2007-01-01,2007-12-31
2856493,MDG_0000000025,REGION,SEAR,,,YEAR,2002,,,,,,,,,46,46,,,,2025-04-07T06:46:44Z,2002,2002-01-01,2002-12-31
2862957,MDG_0000000025,COUNTRY,GRC,EUR,Europe,YEAR,2005,,,,,,,,,100,100,,,"Skilled persons Hellenic Republic, Hellenic Statistical Authority, General Directorate of Statistical Surveys, Vital and Migration Statistics Section, Statistical Output, provided during SDG Country Consultation",2025-04-07T06:46:44Z,2005,2005-01-01,2005-12-31
2863717,MDG_0000000025,COUNTRY,PAN,AMR,Americas,YEAR,2018,,,,,,,,,93,93,,," Estadísticas Vitales - Volumen II - Nacimientos Vivos y Defunciones Fetales: Año 2018 [electronic publication]. Panamá: Instituto Nacional de Estadística y Censo (INEC) [Panama]; 2019 (http://www.contraloria.gob.pa/inec/Publicaciones/subcategoria.aspx?ID_CATEGORIA=3&ID_SUBCATEGORIA=6&ID_IDIOMA=1, accessed 24 January 2019, in Spanish).",2025-04-07T06:46:44Z,2018,2018-01-01,2018-12-31
2867270,MDG_0000000025,REGION,AMR,,,YEAR,2005,,,,,,,,,92,92,,,,2024-04-26T13:59:03Z,2005,2005-01-01,2005-12-31
2869127,MDG_0000000025,COUNTRY,KWT,EMR,Eastern Mediterranean,YEAR,2010,,,,,,,,,99,99,,, Annual Bulletin for Vital Statistics - Births and Deaths 2010. Kuwait City: Central Statistical Bureau (Office) [Kuwait]; 2011.,2025-04-07T06:46:44Z,2010,2010-01-01,2010-12-31
2884297,MDG_0000000025,GLOBAL,GLOBAL,,,YEAR,2001,,,,,,,,,61,61,,,,2024-04-26T13:59:03Z,2001,2001-01-01,2001-12-31
2886500,MDG_0000000025,REGION,EMR,,,YEAR,2005,,,,,,,,,52,52,,,,2024-04-26T13:59:03Z,2005,2005-01-01,2005-12-31
2898527,MDG_0000000025,COUNTRY,CAN,AMR,Americas,YEAR,2006,,,,,,,,,100,100,,, What Mothers Say: The Canadian Maternity Experiences Survey. Ottawa: Public Health Agency of Canada; 2009.,2025-04-07T06:46:44Z,2006,2006-01-01,2006-12-31
2898666,MDG_0000000025,COUNTRY,IRQ,EMR,Eastern Mediterranean,YEAR,2011,,,,,,,,,91,91,,," Iraq Multiple Indicator Cluster Survey 2011. Final Report. Baghdad: Central Statistical Organization (CSO), Kurdistan Regional Statistics Office (KRSO), United Nations Children’s Fund (UNICEF); 2012.",2025-04-07T06:46:44Z,2011,2011-01-01,2011-12-31
2899294,MDG_0000000025,COUNTRY,BIH,EUR,Europe,YEAR,2018,,,,,,,,,100,100,,, Statistical Yearbook Federation of Bosnia and Herzegovina 2019. Sarajevo: Institute for Statistics of Federation of Bosnia and Herzegovina; 2019.,2025-04-07T06:46:44Z,2018,2018-01-01,2018-12-31
2903104,MDG_0000000025,COUNTRY,CZE,EUR,Europe,YEAR,2009,,,,,,,,,100,100,,, Rodi?ka a novorozenec 2009 [Mother and Newborn 2009]. Prague: Ústav zdravotnických informací a statistiky ?R [Institute of Health Information and Statistics of the Czech Republic]; 2009 (in Czech).,2025-04-07T06:46:44Z,2009,2009-01-01,2009-12-31
2910424,MDG_0000000025,COUNTRY,BGR,EUR,Europe,YEAR,2014,,,,,,,,,95,95,,, National Statistical Institute of Bulgaria; 2023.,2025-04-07T06:46:44Z,2014,2014-01-01,2014-12-31
2911227,MDG_0000000025,COUNTRY,IRN,EMR,Eastern Mediterranean,YEAR,2010,,,,,,,,,96,96,,," Rashidian A, Khosravi A, Khabiri R, Khodayari-Moez E, Elahi E, Arab M, Radaie Z. Islamic Republic of Iran’s Multiple Indicator Demographic and Health Survey (IrMIDHS) 2010. Tehran: Ministry of Health and Medical Education; 2012 (in Persian).",2025-04-07T06:46:44Z,2010,2010-01-01,2010-12-31
2914129,MDG_0000000025,COUNTRY,LAO,WPR,Western Pacific,YEAR,2017,,,,,,,,,64,64,,," Lao Statistics Bureau. Lao MICS Social Indicator Survey II 2017, Survey Findings Report. Vientiane, Lao PDR: Lao
Statistics Bureau, UNICEF; 2018.",2025-04-07T06:46:44Z,2017,2017-01-01,2017-12-31
2915399,MDG_0000000025,COUNTRY,GIN,AFR,Africa,YEAR,2003,,,,,,,,,49,49,,, UNICEF. Multiple Indicator Cluster Survey Guinea 2003. Reanalyzed by UNICEF HQ; June 2005.,2025-04-07T06:46:44Z,2003,2003-01-01,2003-12-31
2948684,MDG_0000000025,REGION,EUR,,,YEAR,2004,,,,,,,,,97,97,,,,2025-04-07T06:46:44Z,2004,2004-01-01,2004-12-31
2953828,MDG_0000000025,COUNTRY,SLV,AMR,Americas,YEAR,2003,,,,,,,,,92,92,,,"IB + home delivery with skilled personnel Asociación Demográfica Salvadoreña (ADS), Comité Consultivo Interinstitucional (CCI), Centros para el Control y Prevención de Enfermedades (CDC), Agencia de los Estados Unidos para el Desarrollo Internacional (USAID). Encuesta Nacional de Salud Familiar (FESAL) 2002/03. Informe Final. San Salvador: ADS; 2004 (in Spanish).",2025-04-07T06:46:44Z,2002-2003,2002-01-01,2003-12-31
2956604,MDG_0000000025,COUNTRY,MRT,AFR,Africa,YEAR,2001,,,,,,,,,53,53,,," Office National de la Statistique (ONS) [Mauritanie],ORC Macro. Enquête Démographique et de Santé Mauritanie 2000-2001. Calverton, Maryland, USA: ONS, ORC Macro; 2001 (in French).",2025-04-07T06:46:44Z,2000-2001,2000-01-01,2001-12-31
2958362,MDG_0000000025,COUNTRY,LCA,AMR,Americas,YEAR,2015,,,,,,,,,99,99,,," Health Situation in the Americas: Core Indicators 2016. Washington, DC: Pan American Health Organization/World Health Organization (PAHO/WHO), Communicable Diseases and Health Analysis/Health Information and Analysis; 2016.",2025-04-07T06:46:44Z,2015,2015-01-01,2015-12-31
2961296,MDG_0000000025,COUNTRY,KAZ,EUR,Europe,YEAR,2015,,,,,,,,,99,99,,," The Statistics Committee of the Ministry of National Economy of the Republic of Kazakhstan (Statistics Committee of the MNE RK), the United Nations Children’s Fund (UNICEF), the United Nations Population Fund (UNFPA). 2015 Kazakhstan Multiple Indicator Cluster Survey, Final Report. Astana, Kazakhstan: The Statistics Committee
of the MNE RK, UNICEF, UNFPA; 2016.",2025-04-07T06:46:44Z,2015,2015-01-01,2015-12-31
2964128,MDG_0000000025,COUNTRY,VCT,AMR,Americas,YEAR,2010,,,,,,,,,98,98,,,"Trained personnel PLISA Health Information Platform. Indicator profile: Deliveries attended by skilled birth attendants (%) [online database]. Washington, DC: Pan American Health Organization/World Health Organization (PAHO/WHO); 2021 (https://opendata.paho.org/es/indicadores-basicos/tablero-de-los-indicadores-basicos, accessed 30 December 2021). ",2025-04-07T06:46:44Z,2010,2010-01-01,2010-12-31
2964269,MDG_0000000025,COUNTRY,MAR,EMR,Eastern Mediterranean,YEAR,2004,,,,,,,,,63,63,,,"Doctor (15.7%), nurse, midwife auxiliary midwife (46.9%) Ministère de la Santé [Maroc], ORC Macro, Ligue des États Arabes. Enquête sur la Population et la Santé Familiale (EPSF) 2003-2004. Calverton, Maryland, USA: Ministère de la Santé, ORC Macro; 2005 (in French).",2025-04-07T06:46:44Z,2003-2004,2003-01-01,2004-12-31
2973639,MDG_0000000025,COUNTRY,BGR,EUR,Europe,YEAR,2019,,,,,,,,,92,92,,, National Statistical Institute of Bulgaria; 2022. (Reported on 2 December 2022),2025-04-07T06:46:44Z,2019,2019-01-01,2019-12-31
2979556,MDG_0000000025,COUNTRY,TJK,EUR,Europe,YEAR,2007,,,,,,,,,88,88,,," Tajikistan Living Standards Measurement Survey 2007. Dushanbe: State Committee on Statistics Republic of Tajikistan, United Nations Children's Fund (UNICEF); 2009.",2025-04-07T06:46:44Z,2007,2007-01-01,2007-12-31
2985717,MDG_0000000025,COUNTRY,DEU,EUR,Europe,YEAR,2001,,,,,,,,,99,99,,, Qualitätsbericht 2012. Außerklinische Geburtshilfe in Deutschland. Storkow: Gesellschaft für Qualität in der außerklinischen Geburtshilfe e.V. (QUAG e.V.); 2014 (in German).,2025-04-07T06:46:44Z,2001,2001-01-01,2001-12-31
2988467,MDG_0000000025,COUNTRY,JPN,WPR,Western Pacific,YEAR,2002,,,,,,,,,100,100,,," 2009 Vital Statistics of Japan. Table 4.8: Trends in percent distribution of live births by place of delivery [website]. Tokyo: Ministry of Health, Labour and Welfare [Japan]; 2010 (http://www.mhlw.go.jp). ",2025-04-07T06:46:44Z,2002,2002-01-01,2002-12-31
2989558,MDG_0000000025,COUNTRY,FSM,WPR,Western Pacific,YEAR,2003,,,,,,,,,85,85,,," Statistical Yearbook Federated States of Micronesia 2008. Palikir, Pohnpei: Division of Statistics, Office of Statistics, Budget and Economic Management, Overseas Development Assistance & Compact Management (SBOC) [Federated States of Micronesia]; 2008.",2025-04-07T06:46:44Z,2003,2003-01-01,2003-12-31
2993329,MDG_0000000025,COUNTRY,BGD,SEAR,South-East Asia,YEAR,2001,,,,,,,,,12,12,,,"Doctor, nurse, midwife, family welfare visitor Bangladesh Maternal Health Services and Maternal Mortality Survey 2001. Dhaka: National Institute of Population Research and Training - NIPORT [Bangladesh], ORC Macro, Johns Hopkins University, Centre for Health and Population Research - icddr,b [Bangladesh]; 2003.",2025-04-07T06:46:44Z,2001,2001-01-01,2001-12-31
2996052,MDG_0000000025,COUNTRY,LTU,EUR,Europe,YEAR,2020,,,,,,,,,100,100,,,"Skilled health personnel Official Statistics Portal; 2021 (https://osp.stat.gov.lt/nacionaliniai-darnaus-vystymosi-rodikliai, accessed 30/12/2021)",2025-04-07T06:46:44Z,2020,2020-01-01,2020-12-31
3002642,MDG_0000000025,COUNTRY,ROU,EUR,Europe,YEAR,2016,,,,,,,,,95,95,,," National Institute of Statistics, Vital Statistics regarding live births [Romania]; 2021",2025-04-07T06:46:44Z,2016,2016-01-01,2016-12-31
3005595,MDG_0000000025,COUNTRY,MSR,AMR,Americas,YEAR,2012,,,,,,,,,100,100,,,"Trained personnel PLISA Health Information Platform. Indicator profile: Deliveries attended by skilled birth attendants (%) [online database]. Washington, DC: Pan American Health Organization/World Health Organization (PAHO/WHO); 2021 (https://opendata.paho.org/es/indicadores-basicos/tablero-de-los-indicadores-basicos, accessed 30 December 2021). ",2025-04-07T06:46:44Z,2012,2012-01-01,2012-12-31
3009421,MDG_0000000025,COUNTRY,LSO,AFR,Africa,YEAR,2024,,,,,,,,,89,89,,," Lesotho Demographic and Health Survey 2023–24: Final Report. Maseru, Lesotho, and Rockville, Maryland, USA: Ministry of Health and ICF; 2024.",2025-04-07T06:46:44Z,2023-2024,2023-01-01,2024-12-31
3016745,MDG_0000000025,COUNTRY,NOR,EUR,Europe,YEAR,2003,,,,,,,,,99,99,,," Dataset: F11: Fødested. 2003. [online database]. Oslo: Folkehelseinstituttet, Medisinsk fødselsregister [Norwegian Institute of Public Health (NIPH), Medical Birth Registry]; 2004 (http://statistikkbank.fhi.no/mfr, accessed 10 October 2011, in Norwegian). ",2025-04-07T06:46:44Z,2003,2003-01-01,2003-12-31
3017564,MDG_0000000025,COUNTRY,DNK,EUR,Europe,YEAR,2003,,,,,,,,,99,99,,," Sundhedsstyrelsen [National Board of Health, Denmark]. Nye tal fra Sundhedsstyrelsen - Fødselsregisteret 2004, 2005:4 [New figures from the National Board of Health, Denmark - Birth Registry 2004, 2005:4]. Copenhagen: Sundhedsstyrelsen; 2005 (in Danish).",2025-04-07T06:46:44Z,2003,2003-01-01,2003-12-31
3018468,MDG_0000000025,COUNTRY,FRA,EUR,Europe,YEAR,2011,,,,,,,,,96,96,,," Tableau 64: Conditions d'accouchement selon le groupe d'âges de la mère. Année 2011 [website]. Paris: Institut National de la Statistique et des Études Économiques (INSEE) [National Institute of Statistics and Economic Studies]; 2012 (http://www.insee.fr/en/insee-statistique-publique/default.asp, accessed 18 October 2013, in French).",2025-04-07T06:46:44Z,2011,2011-01-01,2011-12-31
3024396,MDG_0000000025,COUNTRY,CHL,AMR,Americas,YEAR,2014,,,,,,,,,100,100,,, Estadísticas Vitales - Anuario 2014. Santiago: Instituto Nacional de Estadísticas [Chile]; 2016 (in Spanish).,2025-04-07T06:46:44Z,2014,2014-01-01,2014-12-31
3028064,MDG_0000000025,COUNTRY,ISL,EUR,Europe,YEAR,2019,,,,,,,,,98,98,,," Births: Home deliveries as percentage of all deliveries in Iceland 1980-2020 [website]. Reykjavík: Directorate of Health [Iceland]; 2021 (https://www.landlaeknir.is/tolfraedi-og-rannsoknir/tolfraedi/allt-talnaefni/), accessed 28 September 2021. ",2025-04-07T06:46:44Z,2019,2019-01-01,2019-12-31
3033320,MDG_0000000025,COUNTRY,BHR,EMR,Eastern Mediterranean,YEAR,2001,,,,,,,,,98,98,,, Health Statistics of 2001. Bahrain: Ministry of Health; 2002.,2025-04-07T06:46:44Z,2001,2001-01-01,2001-12-31
3033621,MDG_0000000025,COUNTRY,NIC,AMR,Americas,YEAR,2002,,,,,,,,,73,73,,,"Trained personnel PLISA Health Information Platform. Indicator profile: Deliveries attended by skilled birth attendants (%) [online database]. Washington, DC: Pan American Health Organization/World Health Organization (PAHO/WHO); 2021 (https://opendata.paho.org/es/indicadores-basicos/tablero-de-los-indicadores-basicos, accessed 30 December 2021). ",2025-04-07T06:46:44Z,2002,2002-01-01,2002-12-31
3044106,MDG_0000000025,COUNTRY,BGD,SEAR,South-East Asia,YEAR,2019,,,,,,,,,59,59,,,"Doctor, nurse/midwife, parademic/medical assistant (MA/SACMO), family welfare visitor (FWV), community skilled birth attendant (CSBA/PCSBA) Progotir Pathey, Bangladesh Multiple Indicator Cluster Survey 2019, Survey Findings Report. Dhaka:
Bangladesh Bureau of Statistics (BBS), UNICEF Bangladesh; 2019.",2025-04-07T06:46:44Z,2019,2019-01-01,2019-12-31
3046397,MDG_0000000025,COUNTRY,KAZ,EUR,Europe,YEAR,2012,,,,,,,,,100,100,,,"Skilled health personnel Transformative Monitoring for Enhanced Equity (TransMonEE) 2016 Database [online database]. Geneva: UNICEF Europe and Central Asia Regional Office; 2016 (www.transmonee.org, accessed 17 October 2016). ",2025-04-07T06:46:44Z,2012,2012-01-01,2012-12-31
3048320,MDG_0000000025,COUNTRY,GEO,EUR,Europe,YEAR,2014,,,,,,,,,100,100,,," Health Care, Statistical Yearbook 2014 Georgia. Tbilisi: Ministry of Labour, Health and Social Affairs of Georgia, National Centre for Disease Control and Public Health; 2015.",2025-04-07T06:46:44Z,2014,2014-01-01,2014-12-31
3054717,MDG_0000000025,COUNTRY,MLT,EUR,Europe,YEAR,2003,,,,,,,,,100,100,,, National Obstetric Information System (NOIS). Annual Report – 2003. Malta: Department of Health Information (DHI); 2004.,2025-04-07T06:46:44Z,2003,2003-01-01,2003-12-31
3058205,MDG_0000000025,COUNTRY,ATG,AMR,Americas,YEAR,2009,,,,,,,,,100,100,,,"Trained personnel Health Situation in the Americas: Basic Indicators 2010. Washington, DC: Pan American Health Organization/World Health Organization (PAHO/WHO), Health Information and Analysis Project (HSD/HA); 2010.",2025-04-07T06:46:44Z,2009,2009-01-01,2009-12-31
3058713,MDG_0000000025,REGION,EMR,,,YEAR,2013,,,,,,,,,68,68,,,,2024-04-26T13:59:03Z,2013,2013-01-01,2013-12-31
3058771,MDG_0000000025,COUNTRY,PSE,EMR,Eastern Mediterranean,YEAR,2000,,,,,,,,,97,97,,, Health Survey- 2000: Main Findings. Ramallah: Palestinian Central Bureau of Statistics; 2000.,2025-04-07T06:46:44Z,2000,2000-01-01,2000-12-31
3062213,MDG_0000000025,COUNTRY,EST,EUR,Europe,YEAR,2000,,,,,,,,,100,100,,," Estonian Medical Birth Registry (EMBR). Skilled birth attendant, 1992-2019. Tallinn: National Institute for Health Development [Estonia]; 2020 (http://www.tai.ee/en/r-and-d/registers/estonian-medical-birth-registry-and-estonian-abortion-registry/statistics, accessed 15 October 2013).",2025-04-07T06:46:44Z,2000,2000-01-01,2000-12-31
3063279,MDG_0000000025,COUNTRY,TKM,EUR,Europe,YEAR,2002,,,,,,,,,97,97,,,"Skilled health personnel Transformative Monitoring for Enhanced Equity (TransMonEE) 2012 Database [online database]. Geneva: UNICEF Europe and Central Asia Regional Office; 2012 (www.transmonee.org, accessed 1 November 2012). ",2025-04-07T06:46:44Z,2002,2002-01-01,2002-12-31
3065848,MDG_0000000025,COUNTRY,BHR,EMR,Eastern Mediterranean,YEAR,2011,,,,,,,,,100,100,,,Skilled health personnel Health Statistics of 2011. Bahrain: Ministry of Health; 2012.,2025-04-07T06:46:44Z,2011,2011-01-01,2011-12-31
3066413,MDG_0000000025,COUNTRY,SUR,AMR,Americas,YEAR,2009,,,,,,,,,90,90,,,"Trained personnel PLISA Health Information Platform. Indicator profile: Deliveries attended by skilled birth attendants (%) [online database]. Washington, DC: Pan American Health Organization/World Health Organization (PAHO/WHO); 2018 (http://www.paho.org/data/index.php/en/indicators/visualization.html, accessed 11 February 2020). ",2025-04-07T06:46:44Z,2009,2009-01-01,2009-12-31
3069971,MDG_0000000025,COUNTRY,ESP,EUR,Europe,YEAR,2019,,,,,,,,,100,100,,,"Doctor, midwife, nurse  INEbase. Goals and targets from the 2030 Agenda for Sustainabale Development. Indicator 3.1.2 [online database]. Madrid: Insittuto Nacional de Estadística (INE) [Spain]; 2021 (https://www.ine.es/dynt3/ODS/en/objetivo.htm?id=4846) accessed September 29 2021). ",2025-04-07T06:46:44Z,2019,2019-01-01,2019-12-31
