Id,IndicatorCode,SpatialDimension,SpatialDimensionValueCode,ParentLocationCode,ParentLocation,TimeDimension,TimeDim,DisaggregatingDimension1,DisaggregatingDimension1ValueCode,DisaggregatingDimension2,DisaggregatingDimension2ValueCode,DisaggregatingDimension3,DisaggregatingDimension3ValueCode,DataSourceDimension,DataSourceDimensionValueCode,Value,NumericValue,Low,High,Comments,Date,TimeDimensionValue,TimeDimensionBegin,TimeDimensionEnd
5665652,MDG_0000000025,COUNTRY,MEX,AMR,Americas,YEAR,2018,,,,,,,,,92,92,,,"Trained personnel PLISA Health Information Platform. Indicator profile: Deliveries attended by skilled birth attendants (%) [online database]. Washington, DC: Pan American Health Organization/World Health Organization (PAHO/WHO); 2023 (https://opendata.paho.org/es/indicadores-basicos/tablero-de-los-indicadores-basicos, accessed 1 February 2024). ",2025-04-07T06:46:44Z,2018,2018-01-01,2018-12-31
5671802,MDG_0000000025,COUNTRY,NZL,WPR,Western Pacific,YEAR,2008,,,,,,,,,97,97,,," Report on Maternity 2014. Accompanying tables: Labour and Birth: place of birth. Table 37: Number and percentage of women giving birth, by place of birth 2005-2014. Wellington: Ministry of Health [New Zealand]; 2015.",2025-04-07T06:46:44Z,2008,2008-01-01,2008-12-31
5680483,MDG_0000000025,COUNTRY,NOR,EUR,Europe,YEAR,2004,,,,,,,,,99,99,,," Dataset: F11: Fødested. 2004. [online database]. Oslo: Folkehelseinstituttet, Medisinsk fødselsregister [Norwegian Institute of Public Health (NIPH), Medical Birth Registry]; 2005 (http://statistikkbank.fhi.no/mfr, accessed 10 October 2011, in Norwegian). ",2025-04-07T06:46:44Z,2004,2004-01-01,2004-12-31
5689258,MDG_0000000025,COUNTRY,MYS,WPR,Western Pacific,YEAR,2016,,,,,,,,,100,100,,,"Health staff (skilled attendant) Institute for Public Health (IPH), National Institutes of Health, Ministry of Health Malaysia. 2016. National Health and Morbidity Survey (HMNS) 2016; Maternal and Child Health. Vol II: Findings, 2016. pp272",2025-04-07T06:46:44Z,2016,2016-01-01,2016-12-31
5690574,MDG_0000000025,COUNTRY,TJK,EUR,Europe,YEAR,2001,,,,,,,,,81,81,,,"Skilled health personnel Transformative Monitoring for Enhanced Equity (TransMonEE) 2012 Database [online database]. Geneva: UNICEF Europe and Central Asia Regional Office; 2012 (www.transmonee.org, accessed 1 November 2012). ",2025-04-07T06:46:44Z,2001,2001-01-01,2001-12-31
5695569,MDG_0000000025,COUNTRY,GUY,AMR,Americas,YEAR,2007,,,,,,,,,81,81,,," Bureau of Statistics, United Nations Children's Fund (UNICEF). Guyana Multiple Indicator Cluster Survey 2006, Final Report. Georgetown, Guyana: Bureau of Statistics, UNICEF; 2008.",2025-04-07T06:46:44Z,2006-2007,2006-01-01,2007-12-31
5696389,MDG_0000000025,COUNTRY,MSR,AMR,Americas,YEAR,2013,,,,,,,,,98,98,,,"Trained personnel PLISA Health Information Platform. Indicator profile: Deliveries attended by skilled birth attendants (%) [online database]. Washington, DC: Pan American Health Organization/World Health Organization (PAHO/WHO); 2021 (https://opendata.paho.org/es/indicadores-basicos/tablero-de-los-indicadores-basicos, accessed 30 December 2021). ",2025-04-07T06:46:44Z,2013,2013-01-01,2013-12-31
5701159,MDG_0000000025,COUNTRY,TJK,EUR,Europe,YEAR,2016,,,,,,,,,98,98,,,Skilled health workers Bureau of National Statistics of the Republic of Kazakhstan. Sustainable Development Goal Indicator 3.7.2: Proportion of women of reproductive age (aged 15-49 years) who have their need for family planning satisfied with modern methods. Nur-Sultan (Kazakhstan): Bureau of National Statistics; [cited 2025 Feb 4]. Available from: https://kazstat.github.io/sdg-site-kazstat/en/3-7-2/,2025-04-07T06:46:44Z,2016,2016-01-01,2016-12-31
5704843,MDG_0000000025,COUNTRY,SGP,WPR,Western Pacific,YEAR,2001,,,,,,,,,100,100,,,"  Registry of Births and Deaths, Immigration and Checkpoints Authority Singapore",2025-04-07T06:46:44Z,2001,2001-01-01,2001-12-31
5708972,MDG_0000000025,REGION,AMR,,,YEAR,2006,,,,,,,,,92,92,,,,2025-04-07T06:46:44Z,2006,2006-01-01,2006-12-31
5713890,MDG_0000000025,COUNTRY,VCT,AMR,Americas,YEAR,2005,,,,,,,,,100,100,,,"Trained personnel PLISA Health Information Platform. Indicator profile: Deliveries attended by skilled birth attendants (%) [online database]. Washington, DC: Pan American Health Organization/World Health Organization (PAHO/WHO); 2021 (https://opendata.paho.org/es/indicadores-basicos/tablero-de-los-indicadores-basicos, accessed 30 December 2021). ",2025-04-07T06:46:44Z,2005,2005-01-01,2005-12-31
5716011,MDG_0000000025,COUNTRY,GHA,AFR,Africa,YEAR,2006,,,,,,,,,50,50,,," Ghana Multiple Indicator Cluster Survey (MICS) 2006. Ghana: Ghana Statistical Service, Ministry of Health, United Nations Children's Fund (UNICEF); 2007.",2025-04-07T06:46:44Z,2006,2006-01-01,2006-12-31
5716511,MDG_0000000025,COUNTRY,HUN,EUR,Europe,YEAR,2015,,,,,,,,,100,100,,,Skilled live birth attendant  Hungarian Central Statistical Office. Country Consultation. ,2025-04-07T06:46:44Z,2015,2015-01-01,2015-12-31
5718726,MDG_0000000025,COUNTRY,MLT,EUR,Europe,YEAR,2012,,,,,,,,,100,100,,, National Obstetric Information System (NOIS). Annual Report – 2012. Malta: Department of Health Information and Research (DHIR); 2013.,2025-04-07T06:46:44Z,2012,2012-01-01,2012-12-31
5721053,MDG_0000000025,COUNTRY,CUB,AMR,Americas,YEAR,2002,,,,,,,,,100,100,,," Anuario Estadístico de Salud 2011. Edición Especial. La Habana: Dirección Nacional de Registros Médicos y Estadísticas de Salud, Ministerio de Salud Pública de Cuba; 2012 (in Spanish).",2025-04-07T06:46:44Z,2002,2002-01-01,2002-12-31
5723015,MDG_0000000025,REGION,AMR,,,YEAR,2009,,,,,,,,,94,94,,,,2024-04-26T13:59:03Z,2009,2009-01-01,2009-12-31
5725422,MDG_0000000025,COUNTRY,LVA,EUR,Europe,YEAR,2015,,,,,,,,,100,100,,," Statistical Yearbook of Health Care in Latvia 17th edition, 2015. Riga: The Centre for Disease Prevention and Control of Latvia; 2016.",2025-04-07T06:46:44Z,2015,2015-01-01,2015-12-31
5731923,MDG_0000000025,COUNTRY,EST,EUR,Europe,YEAR,2009,,,,,,,,,100,100,,," Estonian Medical Birth Registry (EMBR). Skilled birth attendant, 1992-2019. Tallinn: National Institute for Health Development [Estonia]; 2020",2025-04-07T06:46:44Z,2009,2009-01-01,2009-12-31
5733803,MDG_0000000025,COUNTRY,SVK,EUR,Europe,YEAR,2016,,,,,,,,,98,98,,, National Health Information Centre of the Slovak Republic [Slovakia]; Provided during SDG country consultation 2021. ,2025-04-07T06:46:44Z,2016,2016-01-01,2016-12-31
5739846,MDG_0000000025,COUNTRY,PLW,WPR,Western Pacific,YEAR,2020,,,,,,,,,97,97,,, 2020 Statistical Yearbook. Koror: Ministry of Finance [Palau]; 2021.,2025-04-07T06:46:44Z,2020,2020-01-01,2020-12-31
5747216,MDG_0000000025,COUNTRY,SVK,EUR,Europe,YEAR,2003,,,,,,,,,99,99,,,"Skilled health personnel Transformative Monitoring for Enhanced Equity (TransMonEE) 2012 Database [online database]. Geneva: UNICEF Europe and Central Asia Regional Office; 2012 (www.transmonee.org, accessed 1 November 2012). ",2025-04-07T06:46:44Z,2003,2003-01-01,2003-12-31
5748524,MDG_0000000025,COUNTRY,HRV,EUR,Europe,YEAR,2012,,,,,,,,,100,100,,, Statistical Yearbook of the Republic of Croatia 2013. Zagreb: Croatian Bureau of Statistics; 2013.  ,2025-04-07T06:46:44Z,2012,2012-01-01,2012-12-31
5754581,MDG_0000000025,COUNTRY,FJI,WPR,Western Pacific,YEAR,2012,,,,,,,,,99,99,,,Skilled health personnel Annual Report 2012. Suva: Ministry of Health [Fiji]; 2013. ,2025-04-07T06:46:44Z,2012,2012-01-01,2012-12-31
5757745,MDG_0000000025,COUNTRY,BGR,EUR,Europe,YEAR,2018,,,,,,,,,93,93,,, National Statistical Institute of Bulgaria; 2022. (Reported on 2 December 2022),2025-04-07T06:46:44Z,2018,2018-01-01,2018-12-31
5758201,MDG_0000000025,COUNTRY,HUN,EUR,Europe,YEAR,2001,,,,,,,,,100,100,,,"Skilled health personnel Transformative Monitoring for Enhanced Equity (TransMonEE) 2012 Database [online database]. Geneva: UNICEF Europe and Central Asia Regional Office; 2012 (www.transmonee.org, accessed 1 November 2012). ",2025-04-07T06:46:44Z,2001,2001-01-01,2001-12-31
5763485,MDG_0000000025,COUNTRY,BHR,EMR,Eastern Mediterranean,YEAR,2003,,,,,,,,,98,98,,, Health Statistics of 2003. Bahrain: Ministry of Health; 2004.,2025-04-07T06:46:44Z,2003,2003-01-01,2003-12-31
5770056,MDG_0000000025,COUNTRY,PLW,WPR,Western Pacific,YEAR,2016,,,,,,,,,100,100,,, 2016 Statistical Yearbook. Koror: Ministry of Finance [Palau]; 2017.,2025-04-07T06:46:44Z,2016,2016-01-01,2016-12-31
5773818,MDG_0000000025,COUNTRY,SOM,EMR,Eastern Mediterranean,YEAR,2006,,,,,,,,,9,9,,," Somalia 2006 Multiple Indicator Cluster Survey (MICS). Somalia: Pan Arab Project for Family Health (PAPFAM), United Nations Children's Fund (UNICEF); 2007.",2025-04-07T06:46:44Z,2006,2006-01-01,2006-12-31
5783138,MDG_0000000025,COUNTRY,BGR,EUR,Europe,YEAR,2020,,,,,,,,,95,95,,, National Statistical Institute of Bulgaria; 2022. (Reported on 2 December 2022),2025-04-07T06:46:44Z,2020,2020-01-01,2020-12-31
5784381,MDG_0000000025,COUNTRY,MNE,EUR,Europe,YEAR,2007,,,,,,,,,100,100,,, Statistical Yearbook 2009. Podgorica: Statistical Office [Montenegro]; 2009.,2025-04-07T06:46:44Z,2007,2007-01-01,2007-12-31
5785814,MDG_0000000025,COUNTRY,AZE,EUR,Europe,YEAR,2009,,,,,,,,,100,100,,,Skilled health personnel Statistical Yearbook of Azerbaijan 2013. Baku: State Statistical Committee of the Republic of Azerbaijan; 2013.,2025-04-07T06:46:44Z,2009,2009-01-01,2009-12-31
5790197,MDG_0000000025,COUNTRY,MDG,AFR,Africa,YEAR,2004,,,,,,,,,51,51,,,"Doctor, nurse, midwife and auxiliary  Institut National de la Statistique (INSTAT), ORC Macro. Enquête Démographique et de Santé de Madagascar 2003-2004. Calverton, Maryland, USA: INSTAT, ORC Macro; 2005 (in French).",2025-04-07T06:46:44Z,2003-2004,2003-01-01,2004-12-31
5790580,MDG_0000000025,COUNTRY,DMA,AMR,Americas,YEAR,2018,,,,,,,,,100,100,,,"Trained personnel PLISA Health Information Platform. Indicator profile: Deliveries attended by skilled birth attendants (%) [online database]. Washington, DC: Pan American Health Organization/World Health Organization (PAHO/WHO); 2021 (https://opendata.paho.org/es/indicadores-basicos/tablero-de-los-indicadores-basicos, accessed 30 December 2021). ",2025-04-07T06:46:44Z,2018,2018-01-01,2018-12-31
5791263,MDG_0000000025,GLOBAL,GLOBAL,,,YEAR,2009,,,,,,,,,70,70,,,,2024-04-26T13:59:03Z,2009,2009-01-01,2009-12-31
5792795,MDG_0000000025,COUNTRY,CRI,AMR,Americas,YEAR,2008,,,,,,,,,99,99,,, Estadísticas Vitales 2008. San José: Instituto Nacional de Estadística y Censos (INEC); 2009 (in Spanish).,2025-04-07T06:46:44Z,2008,2008-01-01,2008-12-31
5793575,MDG_0000000025,COUNTRY,AUS,WPR,Western Pacific,YEAR,2019,,,,,,,,,99,99,,, Australian Institute of Health and Welfare 2021. Australia's mothers and babies. Cat. no. PER 101. Canberra: AIHW; 2021.,2025-04-07T06:46:44Z,2019,2019-01-01,2019-12-31
5795443,MDG_0000000025,COUNTRY,KAZ,EUR,Europe,YEAR,2004,,,,,,,,,99,99,,,"Skilled health personnel Transformative Monitoring for Enhanced Equity (TransMonEE) 2012 Database [online database]. Geneva: UNICEF Europe and Central Asia Regional Office; 2012 (www.transmonee.org, accessed 1 November 2012). ",2025-04-07T06:46:44Z,2004,2004-01-01,2004-12-31
5805641,MDG_0000000025,REGION,SEAR,,,YEAR,2024,,,,,,,,,90,90,,,,2025-04-07T06:46:44Z,2024,2024-01-01,2024-12-31
5807398,MDG_0000000025,COUNTRY,BDI,AFR,Africa,YEAR,2016,,,,,,,,,78,78,,, Annuaire des Statistisques Sanitaires 2022,2025-04-07T06:46:44Z,2016,2016-01-01,2016-12-31
5808169,MDG_0000000025,COUNTRY,ARM,EUR,Europe,YEAR,2007,,,,,,,,,100,100,,,"Skilled health personnel Transformative Monitoring for Enhanced Equity (TransMonEE) 2012 Database [online database]. Geneva: UNICEF Europe and Central Asia Regional Office; 2012 (www.transmonee.org, accessed 1 November 2012). ",2025-04-07T06:46:44Z,2007,2007-01-01,2007-12-31
5815406,MDG_0000000025,COUNTRY,AZE,EUR,Europe,YEAR,2002,,,,,,,,,94,94,,,Skilled health personnel Statistical Yearbook of Azerbaijan 2013. Baku: State Statistical Committee of the Republic of Azerbaijan; 2013.,2025-04-07T06:46:44Z,2002,2002-01-01,2002-12-31
5819897,MDG_0000000025,COUNTRY,SGP,WPR,Western Pacific,YEAR,2016,,,,,,,,,100,100,,,"Doctor, ambulance officer, paramedic, midwife, nurse Registry of Births and Deaths. Singapore: Department of Statistics Singapore; 2021 (Sustainable Development Goals: Indicator 3.2.1 [online database] https://www.singstat.gov.sg/find-data/sdg/goal-3#t1, accessed 30 December 2021). ",2025-04-07T06:46:44Z,2016,2016-01-01,2016-12-31
5824951,MDG_0000000025,COUNTRY,PLW,WPR,Western Pacific,YEAR,2009,,,,,,,,,99,99,,, 2013 Statistical Yearbook. Koror: Ministry of Finance [Palau]; 2014.,2025-04-07T06:46:44Z,2009,2009-01-01,2009-12-31
5827592,MDG_0000000025,COUNTRY,URY,AMR,Americas,YEAR,2019,,,,,,,,,100,100,,,"Trained personnel PLISA Health Information Platform. Indicator profile: Deliveries attended by skilled birth attendants (%) [online database]. Washington, DC: Pan American Health Organization/World Health Organization (PAHO/WHO); 2021 (https://opendata.paho.org/es/indicadores-basicos/tablero-de-los-indicadores-basicos, accessed 30 December 2021). ",2025-04-07T06:46:44Z,2019,2019-01-01,2019-12-31
5828497,MDG_0000000025,COUNTRY,DNK,EUR,Europe,YEAR,2020,,,,,,,,,97,97,,," Det Medicinske Fødselsregister (MFR), MFR-kuben, Institutional deliveries [online database]. Copenhagen: Sundhedsdatastyrelsen [National Board of Health Data, Denmark]; 2023 (https://www.esundhed.dk/Emner/Graviditet-foedsler-og-boern/Nyfoedte-og-foedsler-1997-#tabpanel6B95F8298EB444F48C3403E7B75B7202, accessed 21 September, 2023, in Danish).",2025-04-07T06:46:44Z,2020,2020-01-01,2020-12-31
5830201,MDG_0000000025,REGION,AMR,,,YEAR,2013,,,,,,,,,95,95,,,,2024-04-26T13:59:03Z,2013,2013-01-01,2013-12-31
5832725,MDG_0000000025,COUNTRY,LTU,EUR,Europe,YEAR,2010,,,,,,,,,100,100,,,"Skilled health personnel Transformative Monitoring for Enhanced Equity (TransMonEE) 2016 Database [online database]. Geneva: UNICEF Europe and Central Asia Regional Office; 2016 (www.transmonee.org, accessed 17 October 2016). ",2025-04-07T06:46:44Z,2010,2010-01-01,2010-12-31
5835871,MDG_0000000025,COUNTRY,MSR,AMR,Americas,YEAR,2011,,,,,,,,,100,100,,,"Trained personnel PLISA Health Information Platform. Indicator profile: Deliveries attended by skilled birth attendants (%) [online database]. Washington, DC: Pan American Health Organization/World Health Organization (PAHO/WHO); 2021 (https://opendata.paho.org/es/indicadores-basicos/tablero-de-los-indicadores-basicos, accessed 30 December 2021). ",2025-04-07T06:46:44Z,2011,2011-01-01,2011-12-31
5851599,MDG_0000000025,COUNTRY,CHN,WPR,Western Pacific,YEAR,2012,,,,,,,,,100,100,,,Skilled attendant China Statistical Yearbook for Health and Family Planning 2013. Beijing: National Health and Family Planning Commission of China (NHFPC); 2013. ,2025-04-07T06:46:44Z,2012,2012-01-01,2012-12-31
5853985,MDG_0000000025,COUNTRY,ECU,AMR,Americas,YEAR,2016,,,,,,,,,94,94,,,"Doctors, obstetrician and nurse Registro Estadístico de Nacidos Vivos, Instituto Nacional de Estadística y Censos",2025-04-07T06:46:44Z,2016,2016-01-01,2016-12-31
5861794,MDG_0000000025,COUNTRY,HTI,AMR,Americas,YEAR,2017,,,,,,,,,42,42,,," Enquête Mortalité, Morbidité et Utilisation des Services (EMMUS-VI 2016-2017). Pétion-Ville, Haïti, Rockville, Maryland, USA: Institut Haïtien de l’Enfance (IHE), ICF;  2018 (in French).",2025-04-07T06:46:44Z,2016-2017,2016-01-01,2017-12-31
5865113,MDG_0000000025,COUNTRY,URY,AMR,Americas,YEAR,2014,,,,,,,,,100,100,,," Estadísticas Vitales Natalidad 2011-2014, Certificado de Nacido Vivo de Uruguay [website]. Montevideo: Ministerio de Salud Publica, Instituto Nacional de Estadística; 2015 (www.estadisticas.msp.gub.uy/index.php/catalog/19/datafile/F8, accessed 19 April 2014, in Spanish).",2025-04-07T06:46:44Z,2014,2014-01-01,2014-12-31
5866170,MDG_0000000025,COUNTRY,KOR,WPR,Western Pacific,YEAR,2003,,,,,,,,,100,100,,," The 2012 National Survey on Fertility, Family Health & Welfare in Korea. Sejong City: Korea Institute for Health and Social Affairs; 2012 (in Korean). ",2025-04-07T06:46:44Z,2003,2003-01-01,2003-12-31
5875169,MDG_0000000025,COUNTRY,BWA,AFR,Africa,YEAR,2014,,,,,,,,,100,100,,, Botswana Maternal Mortality Ratio (MMR) 2011 – 2015. Gaborone: Statistics Botswana (CSO); 2017.,2025-04-07T06:46:44Z,2014,2014-01-01,2014-12-31
5877172,MDG_0000000025,COUNTRY,DNK,EUR,Europe,YEAR,2002,,,,,,,,,99,99,,," Sundhedsstyrelsen [National Board of Health, Denmark]. Nye tal fra Sundhedsstyrelsen - Fødselsregisteret 2002, 2003:19 [New figures from the National Board of Health, Denmark - Birth Registry 2002, 2003:19]. Copenhagen: Sundhedsstyrelsen; 2003 (in Danish).",2025-04-07T06:46:44Z,2002,2002-01-01,2002-12-31
5883243,MDG_0000000025,COUNTRY,CMR,AFR,Africa,YEAR,2000,,,,,,,,,56,56,,," Enquête Indicateurs Multiples (MICS) au Cameroun 2000. Rapport Principal. Cameroun: Ministère de l'Economie et des Finances, Cameroun, Fonds des Nations Unies pour l'Enfance (UNICEF); 2002 (in French).",2025-04-07T06:46:44Z,2000,2000-01-01,2000-12-31
5889622,MDG_0000000025,COUNTRY,AUT,EUR,Europe,YEAR,2022,,,,,,,,,98,98,,, Statistics Austria. Medical and socio-medical characteristics of newborns.Vienna; 2023 (https://www.statistik.at/en/search?L=1&id=582&tx_solr%5Bq%5D=place+of+birth).,2025-04-07T06:46:44Z,2022,2022-01-01,2022-12-31
5890324,MDG_0000000025,COUNTRY,CHN,WPR,Western Pacific,YEAR,2015,,,,,,,,,100,100,,,Skilled attendant China Statistical Yearbook for Health and Family Planning 2016. Beijing: National Health and Family Planning Commission of China (NHFPC); 2016. ,2025-04-07T06:46:44Z,2015,2015-01-01,2015-12-31
5899731,MDG_0000000025,COUNTRY,GRC,EUR,Europe,YEAR,2011,,,,,,,,,100,100,,,"Skilled persons Hellenic Republic, Hellenic Statistical Authority, General Directorate of Statistical Surveys, Vital and Migration Statistics Section, Statistical Output, provided during SDG Country Consultation",2025-04-07T06:46:44Z,2011,2011-01-01,2011-12-31
5907367,MDG_0000000025,COUNTRY,NIC,AMR,Americas,YEAR,2015,,,,,,,,,94,94,,,"Trained personnel PLISA Health Information Platform. Indicator profile: Deliveries attended by skilled birth attendants (%) [online database]. Washington, DC: Pan American Health Organization/World Health Organization (PAHO/WHO); 2021 (https://opendata.paho.org/es/indicadores-basicos/tablero-de-los-indicadores-basicos, accessed 30 December 2021). ",2025-04-07T06:46:44Z,2015,2015-01-01,2015-12-31
5911572,MDG_0000000025,COUNTRY,NZL,WPR,Western Pacific,YEAR,2021,,,,,,,,,96,96,,, The New Zealand Maternity Clinical Indicators. New Zealand; 2023. (https://www.tewhatuora.govt.nz/our-health-system/data-and-statistics/maternity-clinical-indicators/ accessed 22 September 2023).,2025-04-07T06:46:44Z,2021,2021-01-01,2021-12-31
5919545,MDG_0000000025,COUNTRY,ARG,AMR,Americas,YEAR,2008,,,,,,,,,95,95,,, Estadísticas Vitales. Información Básica – Año 2008. Buenos Aires: Ministerio de Salud [Argentina]; 2009 (in Spanish).,2025-04-07T06:46:44Z,2008,2008-01-01,2008-12-31
5921651,MDG_0000000025,COUNTRY,MMR,SEAR,South-East Asia,YEAR,2010,,,,,,,,,71,71,,,"Doctor, lady health visitor, nurse, midwife (doctor: 28.2%, lady health visitor/nurse: 6.1%, midwife: 36.3%) Ministry of National Planning and Economic Development and Ministry of Health, Myanmar. Myanmar Multiple Indicator Cluster Survey 2009 - 2010 Final Report. Nay Pyi Taw, Myanmar: Ministry of National Planning and Economic Development, Ministry of Health [Myanmar]; 2011.",2025-04-07T06:46:44Z,2009-2010,2009-01-01,2010-12-31
5923130,MDG_0000000025,COUNTRY,COD,AFR,Africa,YEAR,2014,,,,,,,,,80,80,,," Ministère du Plan et Suivi de la Mise en œuvre de la Révolution de la Modernité (MPSMRM), Ministère de la Santé Publique (MSP), ICF International. Enquête Démographique et de Santé en République Démocratique du Congo 2013-2014. Rockville, Maryland, USA: MPSMRM, MSP, ICF International; 2014 (in French).",2025-04-07T06:46:44Z,2014,2014-01-01,2014-12-31
5930563,MDG_0000000025,COUNTRY,CYP,EUR,Europe,YEAR,2019,,,,,,,,,100,100,,," Health Monitoring Unit (HMU), Ministry of Health",2025-04-07T06:46:44Z,2019,2019-01-01,2019-12-31
5936289,MDG_0000000025,COUNTRY,HRV,EUR,Europe,YEAR,2004,,,,,,,,,100,100,,, Statistical Yearbook of the Republic of Croatia 2011. Zagreb: Croatian Bureau of Statistics; 2011.  ,2025-04-07T06:46:44Z,2004,2004-01-01,2004-12-31
5936903,MDG_0000000025,COUNTRY,NOR,EUR,Europe,YEAR,2011,,,,,,,,,99,99,,," Dataset: F11: Fødested. 2011. [online database]. Oslo: Folkehelseinstituttet, Medisinsk fødselsregister [Norwegian Institute of Public Health (NIPH), Medical Birth Registry]; 2012 (http://statistikkbank.fhi.no/mfr, accessed 7 November 2014, in Norwegian). ",2025-04-07T06:46:44Z,2011,2011-01-01,2011-12-31
5942421,MDG_0000000025,COUNTRY,FRA,EUR,Europe,YEAR,2008,,,,,,,,,98,98,,," Tableau 64: Conditions d'accouchement selon le groupe d'âges de la mère. Année 2008 [website]. Paris: Institut National de la Statistique et des Études Économiques (INSEE) [National Institute of Statistics and Economic Studies]; 2009 (http://www.insee.fr/en/insee-statistique-publique/default.asp, accessed 23 November 2011, in French).
",2025-04-07T06:46:44Z,2008,2008-01-01,2008-12-31
5946729,MDG_0000000025,COUNTRY,TLS,SEAR,South-East Asia,YEAR,2002,,,,,,,,,24,24,,,"Doctor, nurse, midwife and auxiliary midwife Timor-Leste Multiple Indicator Cluster Survey (MICS - 2002). Timor-Leste: Government of Timor-Leste, United Nations Children's Fund (UNICEF); 2003.",2025-04-07T06:46:44Z,2002,2002-01-01,2002-12-31
5952784,MDG_0000000025,COUNTRY,UGA,AFR,Africa,YEAR,2016,,,,,,,,,74,74,,," Uganda Bureau of Statistics (UBOS), ICF. Uganda Demographic and Health Survey 2016. Kampala, Uganda and Rockville, Maryland, USA: UBOS, ICF; 2018.",2025-04-07T06:46:44Z,2016,2016-01-01,2016-12-31
5954204,MDG_0000000025,COUNTRY,BGR,EUR,Europe,YEAR,2011,,,,,,,,,92,92,,, National Statistical Institute of Bulgaria; 2023.,2025-04-07T06:46:44Z,2011,2011-01-01,2011-12-31
5960238,MDG_0000000025,COUNTRY,VEN,AMR,Americas,YEAR,2018,,,,,,,,,99,99,,,"Trained personnel PLISA Health Information Platform. Indicator profile: Deliveries attended by skilled birth attendants (%) [online database]. Washington, DC: Pan American Health Organization/World Health Organization (PAHO/WHO); 2021 (https://opendata.paho.org/es/indicadores-basicos/tablero-de-los-indicadores-basicos, accessed 30 December 2021). ",2025-04-07T06:46:44Z,2018,2018-01-01,2018-12-31
5973081,MDG_0000000025,COUNTRY,QAT,EMR,Eastern Mediterranean,YEAR,2003,,,,,,,,,100,100,,," Vital Statistics, Annual Bulletin. Births and Deaths 2003. Doha: The Planning Council [Qatar]; 2004.",2025-04-07T06:46:44Z,2003,2003-01-01,2003-12-31
5975008,MDG_0000000025,COUNTRY,BGR,EUR,Europe,YEAR,2009,,,,,,,,,94,94,,, National Statistical Institute of Bulgaria; 2023.,2025-04-07T06:46:44Z,2009,2009-01-01,2009-12-31
5975992,MDG_0000000025,COUNTRY,BGR,EUR,Europe,YEAR,2012,,,,,,,,,93,93,,, National Statistical Institute of Bulgaria; 2023.,2025-04-07T06:46:44Z,2012,2012-01-01,2012-12-31
5978763,MDG_0000000025,COUNTRY,FRA,EUR,Europe,YEAR,2006,,,,,,,,,98,98,,," Tableau 64: Conditions d'accouchement selon le groupe d'âges de la mère. Année 2006 [website]. Paris: Institut National de la Statistique et des Études Économiques (INSEE) [National Institute of Statistics and Economic Studies]; 2007 (http://www.insee.fr/en/insee-statistique-publique/default.asp, accessed 23 November 2011, in French).
",2025-04-07T06:46:44Z,2006,2006-01-01,2006-12-31
5985755,MDG_0000000025,REGION,EUR,,,YEAR,2018,,,,,,,,,99,99,,,,2024-04-26T13:59:03Z,2018,2018-01-01,2018-12-31
5991409,MDG_0000000025,COUNTRY,URY,AMR,Americas,YEAR,2020,,,,,,,,,100,100,,,"Trained personnel PLISA Health Information Platform. Indicator profile: Deliveries attended by skilled birth attendants (%) [online database]. Washington, DC: Pan American Health Organization/World Health Organization (PAHO/WHO); 2021 (https://opendata.paho.org/es/indicadores-basicos/tablero-de-los-indicadores-basicos, accessed 30 December 2021). ",2025-04-07T06:46:44Z,2020,2020-01-01,2020-12-31
5998169,MDG_0000000025,COUNTRY,ZMB,AFR,Africa,YEAR,2024,,,,,,,,,94,94,,,"Doctor, nurse/midwife, and clinical officer Zambia Demographic and Health Survey 2024. Rockville, Maryland, USA: The DHS Program, ICF; 2024.",2025-04-07T06:46:44Z,2024,2024-01-01,2024-12-31
6001505,MDG_0000000025,COUNTRY,PAN,AMR,Americas,YEAR,2014,,,,,,,,,94,94,,," Estadísticas Vitales - Volumen II - Nacimientos Vivos y Defunciones Fetales: Año 2014 [electronic publication]. Panamá: Instituto Nacional de Estadística y Censo (INEC) [Panama]; 2015 (http://www.contraloria.gob.pa/inec/Publicaciones, accessed 19 April 2016, in Spanish).",2025-04-07T06:46:44Z,2014,2014-01-01,2014-12-31
6003722,MDG_0000000025,COUNTRY,CHN,WPR,Western Pacific,YEAR,2013,,,,,,,,,100,100,,,Skilled attendant China Statistical Yearbook for Health and Family Planning 2014. Beijing: National Health and Family Planning Commission of China (NHFPC); 2014. ,2025-04-07T06:46:44Z,2013,2013-01-01,2013-12-31
6013738,MDG_0000000025,COUNTRY,CRI,AMR,Americas,YEAR,2014,,,,,,,,,99,99,,, Estadísticas Vitales 2014. San José: Instituto Nacional de Estadística y Censos (INEC); 2015 (in Spanish).,2025-04-07T06:46:44Z,2014,2014-01-01,2014-12-31
6020749,MDG_0000000025,COUNTRY,CAN,AMR,Americas,YEAR,2021,,,,,,,,,98,98,,," Statistics Canada. Table 13-10-0429-01  Live births and fetal deaths (stillbirths), by place of birth (hospital or non-hospital). Canada; 2023. DOI: https://doi.org/10.25318/1310042901-eng",2025-04-07T06:46:44Z,2021,2021-01-01,2021-12-31
6021274,MDG_0000000025,COUNTRY,COL,AMR,Americas,YEAR,2012,,,,,,,,,99,99,,," DANE [online database]. Estadísticas Vitales - Nacimientos. 2012. Bogotá D.C.: Departamento Administrativo Nacional de Estadística (DANE); 2012 (https://www.dane.gov.co/index.php/es/poblacion-y-registros-vitales/nacimientos-y-defunciones/nacimientos-y-defunciones/118-demograficas/estadisticas-vitales/2879-nacimientos, accessed 22 October 2014, in Spanish).  ",2025-04-07T06:46:44Z,2012,2012-01-01,2012-12-31
