Id,IndicatorCode,SpatialDimension,SpatialDimensionValueCode,ParentLocationCode,ParentLocation,TimeDimension,TimeDim,DisaggregatingDimension1,DisaggregatingDimension1ValueCode,DisaggregatingDimension2,DisaggregatingDimension2ValueCode,DisaggregatingDimension3,DisaggregatingDimension3ValueCode,DataSourceDimension,DataSourceDimensionValueCode,Value,NumericValue,Low,High,Comments,Date,TimeDimensionValue,TimeDimensionBegin,TimeDimensionEnd
8393483,MDG_0000000025,COUNTRY,BLR,EUR,Europe,YEAR,2021,,,,,,,,,100,100,,,"Qualified medical personnel National platform for reporting indicators of Sustainable Development Goals. http://sdgplatform.belstat.gov.by/datasets/3.1.2, last accessed 6/12/2023",2025-04-07T06:46:44Z,2021,2021-01-01,2021-12-31
8405095,MDG_0000000025,COUNTRY,LSO,AFR,Africa,YEAR,2000,,,,,,,,,48,48,,," 2000 End Decade Multiple Indicator Cluster Survey (EMICS). Draft Preliminary Report. Maseru: Bureau of Statistics [Lesotho], United Nations Children's Fund (UNICEF); 2002.",2025-04-07T06:46:44Z,2000,2000-01-01,2000-12-31
8421735,MDG_0000000025,COUNTRY,BMU,AMR,Americas,YEAR,2005,,,,,,,,,100,100,,,"Trained personnel PLISA Health Information Platform. Indicator profile: Deliveries attended by skilled birth attendants (%) [online database]. Washington, DC: Pan American Health Organization/World Health Organization (PAHO/WHO); 2023 (https://opendata.paho.org/es/indicadores-basicos/tablero-de-los-indicadores-basicos, accessed 20 September 2023).",2025-04-07T06:46:44Z,2005,2005-01-01,2005-12-31
8430199,MDG_0000000025,COUNTRY,COL,AMR,Americas,YEAR,2004,,,,,,,,,96,96,,," DANE [online database]. Estadísticas Vitales - Nacimientos. 2004. Bogotá D.C.: Departamento Administrativo Nacional de Estadística (DANE); 2011 (http://www.dane.gov.co/daneweb_V09/index.php?option=com_content&view=article&id=786&Itemid=119, accessed 30 May 2011, in Spanish).  ",2025-04-07T06:46:44Z,2004,2004-01-01,2004-12-31
8430404,MDG_0000000025,COUNTRY,KIR,WPR,Western Pacific,YEAR,2009,,,,,,,,,80,80,,," Kiribati National Statistics Office (KNSO), Secretariat of the Pacific Community (SPC) [New Caledonia]. Kiribati Demographic and Health Survey 2009. Noumea: SPC; 2010.",2025-04-07T06:46:44Z,2009,2009-01-01,2009-12-31
8438255,MDG_0000000025,COUNTRY,DNK,EUR,Europe,YEAR,2014,,,,,,,,,96,96,,," Det Medicinske Fødselsregister (MFR), MFR-kuben, Institutional deliveries [online database]. Copenhagen: Sundhedsdatastyrelsen [National Board of Health Data, Denmark]; 2017 (http://www.esundhed.dk/sundhedsregistre/MFR/Sider/MFR06A.aspx, accessed 1 November 2017, in Danish).",2025-04-07T06:46:44Z,2014,2014-01-01,2014-12-31
8445308,MDG_0000000025,COUNTRY,GTM,AMR,Americas,YEAR,2017,,,,,,,,,70,70,,,"Trained personnel PLISA Health Information Platform. Indicator profile: Deliveries attended by skilled birth attendants (%) [online database]. Washington, DC: Pan American Health Organization/World Health Organization (PAHO/WHO); 2021 (https://opendata.paho.org/es/indicadores-basicos/tablero-de-los-indicadores-basicos, accessed 30 December 2021). ",2025-04-07T06:46:44Z,2017,2017-01-01,2017-12-31
8447055,MDG_0000000025,COUNTRY,NIC,AMR,Americas,YEAR,2011,,,,,,,,,90,90,,,"Trained personnel PLISA Health Information Platform. Indicator profile: Deliveries attended by skilled birth attendants (%) [online database]. Washington, DC: Pan American Health Organization/World Health Organization (PAHO/WHO); 2021 (https://opendata.paho.org/es/indicadores-basicos/tablero-de-los-indicadores-basicos, accessed 30 December 2021). ",2025-04-07T06:46:44Z,2011,2011-01-01,2011-12-31
8448980,MDG_0000000025,COUNTRY,BMU,AMR,Americas,YEAR,2002,,,,,,,,,99,99,,,"Trained personnel PLISA Health Information Platform. Indicator profile: Deliveries attended by skilled birth attendants (%) [online database]. Washington, DC: Pan American Health Organization/World Health Organization (PAHO/WHO); 2023 (https://opendata.paho.org/es/indicadores-basicos/tablero-de-los-indicadores-basicos, accessed 20 September 2023).",2025-04-07T06:46:44Z,2002,2002-01-01,2002-12-31
8452555,MDG_0000000025,COUNTRY,QAT,EMR,Eastern Mediterranean,YEAR,2021,,,,,,,,,100,100,,," Vital Statistics, Annual Bulletin. Births and Deaths 2021. Doha: Ministry of Development Planning and Statistics [Qatar]; 2023.",2025-04-07T06:46:44Z,2021,2021-01-01,2021-12-31
8468653,MDG_0000000025,COUNTRY,SVN,EUR,Europe,YEAR,2002,,,,,,,,,100,100,,, Statistical Yearbook 2006. Ljubljana: Statistical Office of the Republic of Slovenia; 2006.,2025-04-07T06:46:44Z,2002,2002-01-01,2002-12-31
8488982,MDG_0000000025,COUNTRY,TON,WPR,Western Pacific,YEAR,2006,,,,,,,,,98,98,,,Trained personnel Report of the Minister for Health for the Year 2010. Tonga: Ministry of Health [Tonga]; 2011.,2025-04-07T06:46:44Z,2006,2006-01-01,2006-12-31
8494840,MDG_0000000025,COUNTRY,BGD,SEAR,South-East Asia,YEAR,2022,,,,,,,,,70,70,,,"qualified doctor, nurse/midwife/paramedic, family welfare visitor, community skilled birth attendant, medical assistant/sub-assistant community medical officer National Institute of Population Research and Training (NIPORT) and ICF. 2023. Bangladesh Demographic and Health Survey 2022: Key Indicators Report. Dhaka, Bangladesh, and Rockville, Maryland, USA: NIPORT and ICF.",2025-04-07T06:46:44Z,2022,2022-01-01,2022-12-31
8496242,MDG_0000000025,COUNTRY,TCD,AFR,Africa,YEAR,2004,,,,,,,,,14,14,,," Ouagadjio B, Nodjimadji K, Bagamla T, Madnodji R, Tokindang JS, Ngakoutou N et al. (INSEED, ORC Macro). Enquête Démographique et de Santé Tchad 2004. Calverton, Maryland, USA: INSEED, ORC Macro; 2005 (in French).",2025-04-07T06:46:44Z,2004,2004-01-01,2004-12-31
8497506,MDG_0000000025,COUNTRY,CUB,AMR,Americas,YEAR,2008,,,,,,,,,100,100,,," Anuario Estadístico de Salud 2015. La Habana: Dirección de Registros Médicos y Estadísticas de Salud, Ministerio de Salud Pública de Cuba; 2016 (in Spanish).",2025-04-07T06:46:44Z,2008,2008-01-01,2008-12-31
8497963,MDG_0000000025,REGION,WPR,,,YEAR,2019,,,,,,,,,98,98,,,,2025-04-07T06:46:44Z,2019,2019-01-01,2019-12-31
8499625,MDG_0000000025,COUNTRY,ESP,EUR,Europe,YEAR,2020,,,,,,,,,100,100,,,"Doctor, midwife, nurse  INEbase. Goals and targets from the 2030 Agenda for Sustainabale Development. Indicator 3.1.2 [online database]. Madrid: Insittuto Nacional de Estadística (INE) [Spain]; 2021 (https://www.ine.es/dynt3/ODS/en/objetivo.htm?id=4846) accessed September 29 2021). ",2025-04-07T06:46:44Z,2020,2020-01-01,2020-12-31
8500717,MDG_0000000025,COUNTRY,IRL,EUR,Europe,YEAR,2004,,,,,,,,,100,100,,," Report on Perinatal Statistics for 2004. Dublin: Health Policy and Information Division, the Economic and Social Research Institute (ESRI); 2007.  ",2025-04-07T06:46:44Z,2004,2004-01-01,2004-12-31
8501674,MDG_0000000025,COUNTRY,AIA,AMR,Americas,YEAR,2013,,,,,,,,,100,100,,,"Trained personnel PLISA Health Information Platform. Indicator profile: Deliveries attended by skilled birth attendants (%) [online database]. Washington, DC: Pan American Health Organization/World Health Organization (PAHO/WHO); 2021 (https://opendata.paho.org/es/indicadores-basicos/tablero-de-los-indicadores-basicos), accessed December 30, 2021). 	",2025-04-07T06:46:44Z,2013,2013-01-01,2013-12-31
8503182,MDG_0000000025,COUNTRY,THA,SEAR,South-East Asia,YEAR,2009,,,,,,,,,99,99,,," Key Findings: The 2009 Reproductive Health Survey. Bangkok: National Statistical Office Thailand, Ministry of Public Health [Thailand], United Nations Population Fund (UNFPA), Chulalongkorn University; 2010.",2025-04-07T06:46:44Z,2009,2009-01-01,2009-12-31
8504819,MDG_0000000025,REGION,WPR,,,YEAR,2014,,,,,,,,,96,96,,,,2024-04-26T13:59:03Z,2014,2014-01-01,2014-12-31
8505648,MDG_0000000025,COUNTRY,NIU,WPR,Western Pacific,YEAR,2005,,,,,,,,,100,100,,,Skilled health personnel Western Pacific Country Health Information Profiles: 2006 Revision. Manila: World Health Organization Regional Office for the Western Pacific (WPRO); 2006.,2025-04-07T06:46:44Z,2005,2005-01-01,2005-12-31
8518657,MDG_0000000025,COUNTRY,MLT,EUR,Europe,YEAR,2008,,,,,,,,,100,100,,, National Obstetric Information System (NOIS). Annual Report – 2008. Malta: Department of Health Information and Research (DHIR); 2009.,2025-04-07T06:46:44Z,2008,2008-01-01,2008-12-31
8519612,MDG_0000000025,COUNTRY,AFG,EMR,Eastern Mediterranean,YEAR,2023,,,,,,,,,68,68,,,"  UNICEF. 2023. Afghanistan Multiple Indicator Cluster Survey 2022-23, Summary Findings Report.
Kabul, Afghanistan: UNICEF.",2025-04-07T06:46:44Z,2022-2023,2022-01-01,2023-12-31
8522749,MDG_0000000025,COUNTRY,CYP,EUR,Europe,YEAR,2012,,,,,,,,,99,99,,, Statistical Service. Demographic Report 2012. Republic of Cyprus; 2014.,2025-04-07T06:46:44Z,2012,2012-01-01,2012-12-31
8528490,MDG_0000000025,COUNTRY,HTI,AMR,Americas,YEAR,2012,,,,,,,,,37,37,,," Cayemittes M, Busangu MF, de Dieu Bizimana J, Barrère B, Sévère B, Cayemittes V, Charles E (MSPP, IHE, ICF International). Enquête Mortalité, Morbidité et Utilisation des Services, Haïti, 2012. Calverton, Maryland, USA : MSPP, IHE, ICF International; 2013 (in French).
",2025-04-07T06:46:44Z,2012,2012-01-01,2012-12-31
8530395,MDG_0000000025,COUNTRY,SAU,EMR,Eastern Mediterranean,YEAR,2017,,,,,,,,,100,100,,,Skilled health personnel Household Health Survey 2017.  General Authority for Statistics [Saudi Arabia]; 2018. ,2025-04-07T06:46:44Z,2017,2017-01-01,2017-12-31
8532824,MDG_0000000025,COUNTRY,CYP,EUR,Europe,YEAR,2010,,,,,,,,,99,99,,, Statistical Service. Demographic Report 2012. Republic of Cyprus; 2014.,2025-04-07T06:46:44Z,2010,2010-01-01,2010-12-31
8536113,MDG_0000000025,COUNTRY,BGR,EUR,Europe,YEAR,2010,,,,,,,,,93,93,,, National Statistical Institute of Bulgaria; 2023.,2025-04-07T06:46:44Z,2010,2010-01-01,2010-12-31
8537661,MDG_0000000025,COUNTRY,JPN,WPR,Western Pacific,YEAR,2021,,,,,,,,,100,100,,," 2021 vital statistics of Japan Volume 1, Natality Table 4.9: Number of live births by place of delivery : Japan, each prefecture (special wards and specified cities), 2021 (https://www.e-stat.go.jp/stat-search/files?page=1&query=2021%E5%B9%B4&layout=dataset&toukei=00450011&tstat=000001028897&cycle=7&month=0&tclass1=000001053058&tclass2=000001053061&tclass3=000001053064&stat_infid=000032235776&tclass4val=0&metadata=1&data=1)",2025-04-07T06:46:44Z,2021,2021-01-01,2021-12-31
8542011,MDG_0000000025,COUNTRY,MDA,EUR,Europe,YEAR,2008,,,,,,,,,100,100,,,"Skilled health personnel Transformative Monitoring for Enhanced Equity (TransMonEE) 2012 Database [online database]. Geneva: UNICEF Europe and Central Asia Regional Office; 2012 (www.transmonee.org, accessed 1 November 2012). ",2025-04-07T06:46:44Z,2008,2008-01-01,2008-12-31
8551605,MDG_0000000025,COUNTRY,HUN,EUR,Europe,YEAR,2014,,,,,,,,,99,99,,,"Skilled health personnel Transformative Monitoring for Enhanced Equity (TransMonEE) 2016 Database [online database]. Geneva: UNICEF Europe and Central Asia Regional Office; 2016 (www.transmonee.org, accessed 17 October 2016). ",2025-04-07T06:46:44Z,2014,2014-01-01,2014-12-31
8556006,MDG_0000000025,COUNTRY,BRA,AMR,Americas,YEAR,2003,,,,,,,,,98,98,,," DATASUS [online database]. Brazil: MS/SVS/DASIS - Sistema de Informações sobre Nacidos Vivos – SINASC. Nascim p/resid.mãe por ocorrência segundo Região. Período: 2003; 2011 (http://tabnet.datasus.gov.br/cgi/deftohtm.exe?sinasc/cnv/nvuf.def, accessed 27 July 2011, in Portuguese).",2025-04-07T06:46:44Z,2003,2003-01-01,2003-12-31
8563247,MDG_0000000025,COUNTRY,LTU,EUR,Europe,YEAR,2000,,,,,,,,,100,100,,,"Skilled health personnel Transformative Monitoring for Enhanced Equity (TransMonEE) 2012 Database [online database]. Geneva: UNICEF Europe and Central Asia Regional Office; 2012 (www.transmonee.org, accessed 1 November 2012). ",2025-04-07T06:46:44Z,2000,2000-01-01,2000-12-31
8567459,MDG_0000000025,COUNTRY,DMA,AMR,Americas,YEAR,2013,,,,,,,,,100,100,,,"Trained personnel PLISA Health Information Platform. Indicator profile: Deliveries attended by skilled birth attendants (%) [online database]. Washington, DC: Pan American Health Organization/World Health Organization (PAHO/WHO); 2021 (https://opendata.paho.org/es/indicadores-basicos/tablero-de-los-indicadores-basicos, accessed 30 December 2021). ",2025-04-07T06:46:44Z,2013,2013-01-01,2013-12-31
8572223,MDG_0000000025,COUNTRY,ATG,AMR,Americas,YEAR,2015,,,,,,,,,100,100,,," Health Situation in the Americas: Core Indicators 2016. Washington, DC: Pan American Health Organization/World Health Organization (PAHO/WHO), Communicable Diseases and Health Analysis/Health Information and Analysis; 2016.",2025-04-07T06:46:44Z,2015,2015-01-01,2015-12-31
8576807,MDG_0000000025,COUNTRY,AUT,EUR,Europe,YEAR,2018,,,,,,,,,98,98,,," Vital statistics. Live births (with place of birth in Austria) by medical characteristics since 2008 [website]. Vienna: Statistics Austria; 2019 (http://www.statistik.at/web_en/statistics/PeopleSociety/health/medical_and_sociomedical_characteristics_of_live_birth/110639.html, accessed 10 February 2020).",2025-04-07T06:46:44Z,2018,2018-01-01,2018-12-31
8580723,MDG_0000000025,COUNTRY,SGP,WPR,Western Pacific,YEAR,2014,,,,,,,,,100,100,,,"  Registry of Births and Deaths, Immigration and Checkpoints Authority Singapore",2025-04-07T06:46:44Z,2014,2014-01-01,2014-12-31
8581966,MDG_0000000025,COUNTRY,GMB,AFR,Africa,YEAR,2020,,,,,,,,,84,84,,," Gambia Bureau of Statistics (GBoS) and ICF. 2021. The Gambia Demographic and Health Survey 2019-20. Banjul, The Gambia and Rockville, Maryland, USA: GBoS and ICF.",2025-04-07T06:46:44Z,2019-2020,2019-01-01,2020-12-31
8586030,MDG_0000000025,COUNTRY,TKM,EUR,Europe,YEAR,2019,,,,,,,,,100,100,,,"Doctor, Nurse/midwife, Feldsher 2019 Turkmenistan Multiple Indicator Cluster Survey. Survey Findings Report. Ashgabat: State Committee for Statistics of Turkmenistan, UNICEF; 2020.",2025-04-07T06:46:44Z,2019,2019-01-01,2019-12-31
8594179,MDG_0000000025,COUNTRY,KEN,AFR,Africa,YEAR,2022,,,,,,,,,89,89,,,"doctor, nurse, midwife, clinical officer KNBS and ICF. 2023. Kenya Demographic and Health Survey 2022. Nairobi, Kenya, and Rockville, Maryland,
USA: KNBS and ICF.",2025-04-07T06:46:44Z,2022,2022-01-01,2022-12-31
8594631,MDG_0000000025,COUNTRY,CMR,AFR,Africa,YEAR,2014,,,,,,,,,65,65,,," Institut National de la Statistique, UNICEF. Enquête par grappes à indicateurs multiples (MICS5), 2014, Rapport Final. Yaoundé, Cameroun, Institut National de la Statistique; 2015 (in French).",2025-04-07T06:46:44Z,2014,2014-01-01,2014-12-31
8599447,MDG_0000000025,COUNTRY,TUR,EUR,Europe,YEAR,2018,,,,,,,,,99,99,,," Turkey Demographic and Health Survey 2018. Hacettepe University Institute of Population Studies, T.R. Presidency of Turkey Directorate of Strategy and Budget and TÜB?TAK, Ankara, Turkey.",2025-04-07T06:46:44Z,2018,2018-01-01,2018-12-31
8601068,MDG_0000000025,COUNTRY,TKM,EUR,Europe,YEAR,2016,,,,,,,,,100,100,,," The State Committee of Statistics of Turkmenistan, United Nations Children's Fund (UNICEF). 2015-2016 Turkmenistan Multiple Indicator Cluster Survey, Final Report. Ashgabat, Turkmenistan: The State Committee of Statistics of Turkmenistan, UNICEF; 2016.",2025-04-07T06:46:44Z,2015-2016,2015-01-01,2016-12-31
8602502,MDG_0000000025,COUNTRY,VCT,AMR,Americas,YEAR,2013,,,,,,,,,99,99,,,"Trained personnel PLISA Health Information Platform. Indicator profile: Deliveries attended by skilled birth attendants (%) [online database]. Washington, DC: Pan American Health Organization/World Health Organization (PAHO/WHO); 2021 (https://opendata.paho.org/es/indicadores-basicos/tablero-de-los-indicadores-basicos, accessed 30 December 2021). ",2025-04-07T06:46:44Z,2013,2013-01-01,2013-12-31
8603701,MDG_0000000025,COUNTRY,NER,AFR,Africa,YEAR,2016,,,,,,,,,39,39,,, Annuaire des statistiques sanitaires du Niger. Annee 2016. Miamey: Ministere de la Sante Publique [Republique du Niger]; 2017 (in French). ,2025-04-07T06:46:44Z,2016,2016-01-01,2016-12-31
8603854,MDG_0000000025,COUNTRY,COL,AMR,Americas,YEAR,2018,,,,,,,,,98,98,,," DANE [online database]. Estadísticas Vitales - Nacimientos 2018. Cifras definitivas 2018. Bogotá D.C.: Departamento Administrativo Nacional de Estadística (DANE); 2019 (https://www.dane.gov.co/index.php/estadisticas-por-tema/salud/nacimientos-y-defunciones/nacimientos/nacimientos-2018, accessed 28 January 2020, in Spanish).  ",2025-04-07T06:46:44Z,2018,2018-01-01,2018-12-31
8608211,MDG_0000000025,COUNTRY,SVN,EUR,Europe,YEAR,2008,,,,,,,,,100,100,,, Statistical Yearbook 2011. Ljubljana: Statistical Office of the Republic of Slovenia; 2011.,2025-04-07T06:46:44Z,2008,2008-01-01,2008-12-31
8610445,MDG_0000000025,COUNTRY,DMA,AMR,Americas,YEAR,2017,,,,,,,,,100,100,,,"Trained personnel PLISA Health Information Platform. Indicator profile: Deliveries attended by skilled birth attendants (%) [online database]. Washington, DC: Pan American Health Organization/World Health Organization (PAHO/WHO); 2021 (https://opendata.paho.org/es/indicadores-basicos/tablero-de-los-indicadores-basicos, accessed 30 December 2021). ",2025-04-07T06:46:44Z,2017,2017-01-01,2017-12-31
8619400,MDG_0000000025,COUNTRY,BTN,SEAR,South-East Asia,YEAR,2023,,,,,,,,,99,99,,,"Skilled provider includes Medical Doctors and midwifes (Nurses, and Health Assistants). Ministry of Health, Royal Government of Bhutan. 5th National Health Survey: Integrated Stepwise Household Survey 2023. Thimphu, Bhutan: Ministry of Health; 2024.",2025-04-07T06:46:44Z,2023,2023-01-01,2023-12-31
8625920,MDG_0000000025,COUNTRY,ITA,EUR,Europe,YEAR,2018,,,,,,,,,100,100,,," Certificato di assistenza al parto (CeDAP). Analisi dell’evento nascita - Anno 2018. Roma: Direzione Generale della Digitalizzazione, del Sistema Informativo Sanitario e della Statistica – Ufficio di Statistica; 2021 (in Italian). ",2025-04-07T06:46:44Z,2018,2018-01-01,2018-12-31
8626572,MDG_0000000025,COUNTRY,GRC,EUR,Europe,YEAR,2017,,,,,,,,,100,100,,,"Skilled persons Hellenic Republic, Hellenic Statistical Authority, General Directorate of Statistical Surveys, Vital and Migration Statistics Section, Statistical Output, provided during SDG Country Consultation",2025-04-07T06:46:44Z,2017,2017-01-01,2017-12-31
8631805,MDG_0000000025,COUNTRY,BRB,AMR,Americas,YEAR,2012,,,,,,,,,99,99,,," Barbados Statistical Service, ‘Barbados Multiple Indicator Cluster Survey 2012: Final Report’. BSS, Bridgetown, Barbados: Barbados Statistical Service, United Nations Children’s Fund (UNICEF), United Nations Population Fund (UNFPA), United Nations Entity for Gender Equality and the Empowerment of Women (UN Women); 2014.",2025-04-07T06:46:44Z,2012,2012-01-01,2012-12-31
8631864,MDG_0000000025,COUNTRY,OMN,EMR,Eastern Mediterranean,YEAR,2011,,,,,,,,,99,99,,,"Skilled personnel Annual Health Report 2011. Muscat: Ministry of Health, Department of Health Information and Statistics, Directorate General of Planning [Oman]; 2012.",2025-04-07T06:46:44Z,2011,2011-01-01,2011-12-31
8640596,MDG_0000000025,COUNTRY,HUN,EUR,Europe,YEAR,2007,,,,,,,,,100,100,,,"Skilled health personnel Transformative Monitoring for Enhanced Equity (TransMonEE) 2012 Database [online database]. Geneva: UNICEF Europe and Central Asia Regional Office; 2012 (www.transmonee.org, accessed 1 November 2012). ",2025-04-07T06:46:44Z,2007,2007-01-01,2007-12-31
8649319,MDG_0000000025,COUNTRY,PAK,EMR,Eastern Mediterranean,YEAR,2018,,,,,,,,,69,69,,,"Doctor (59.8%), nurse, midwife, lady health visitor, and community midwife (9.5%) National Institute of Population Studies (NIPS) [Pakistan], ICF. Pakistan Demographic and Health Survey 2017-18. Islamabad, Pakistan, and Rockville, Maryland, USA: NIPS, ICF; 2019.",2025-04-07T06:46:44Z,2017-2018,2017-01-01,2018-12-31
8651186,MDG_0000000025,COUNTRY,FJI,WPR,Western Pacific,YEAR,2005,,,,,,,,,97,97,,, Annual Report 2006. Suva: Ministry of Health [Fiji]; 2007. ,2025-04-07T06:46:44Z,2005,2005-01-01,2005-12-31
8652600,MDG_0000000025,COUNTRY,IRL,EUR,Europe,YEAR,2001,,,,,,,,,100,100,,, Report on Perinatal Statistics for 2001. Dublin: The Economic and Social Research Institute (ESRI); 2005.  ,2025-04-07T06:46:44Z,2001,2001-01-01,2001-12-31
8657661,MDG_0000000025,COUNTRY,MKD,EUR,Europe,YEAR,2010,,,,,,,,,100,100,,, Statistical Yearbook of the Republic of Macedonia 2012. Skopje: State Statistical Office [Macedonia]; 2012.,2025-04-07T06:46:44Z,2010,2010-01-01,2010-12-31
8659874,MDG_0000000025,COUNTRY,BLR,EUR,Europe,YEAR,2013,,,,,,,,,100,100,,,"Skilled health personnel Transformative Monitoring for Enhanced Equity (TransMonEE) 2016 Database [online database]. Geneva: UNICEF Europe and Central Asia Regional Office; 2016 (www.transmonee.org, accessed 17 October 2016). ",2025-04-07T06:46:44Z,2013,2013-01-01,2013-12-31
8667837,MDG_0000000025,COUNTRY,JPN,WPR,Western Pacific,YEAR,2001,,,,,,,,,100,100,,," 2009 Vital Statistics of Japan. Table 4.8: Trends in percent distribution of live births by place of delivery [website]. Tokyo: Ministry of Health, Labour and Welfare [Japan]; 2010 (http://www.mhlw.go.jp). ",2025-04-07T06:46:44Z,2001,2001-01-01,2001-12-31
8668362,MDG_0000000025,COUNTRY,ARM,EUR,Europe,YEAR,2012,,,,,,,,,100,100,,,"Skilled health personnel Transformative Monitoring for Enhanced Equity (TransMonEE) 2016 Database [online database]. Geneva: UNICEF Europe and Central Asia Regional Office; 2016 (www.transmonee.org, accessed 17 October 2016). ",2025-04-07T06:46:44Z,2012,2012-01-01,2012-12-31
8672800,MDG_0000000025,COUNTRY,PRY,AMR,Americas,YEAR,2009,,,,,,,,,94,94,,," Estadísticas Vitales del Paraguay 2009. Fernando de la Mora: Dirección General de Estadística, Encuestas y Censos (DGEEC) [Paraguay]; 2012 (in Spanish).",2025-04-07T06:46:44Z,2009,2009-01-01,2009-12-31
8674657,MDG_0000000025,COUNTRY,BWA,AFR,Africa,YEAR,2017,,,,,,,,,100,100,,, Botswana Maternal Mortality Ratio 2017. Gaborone: Statistics Botswana (CSO); 2019.,2025-04-07T06:46:44Z,2017,2017-01-01,2017-12-31
8684841,MDG_0000000025,COUNTRY,ARG,AMR,Americas,YEAR,2007,,,,,,,,,99,99,,, Estadísticas Vitales. Información Básica – Año 2007. Buenos Aires: Ministerio de Salud [Argentina]; 2008 (in Spanish).,2025-04-07T06:46:44Z,2007,2007-01-01,2007-12-31
8688043,MDG_0000000025,COUNTRY,FJI,WPR,Western Pacific,YEAR,2015,,,,,,,,,100,100,,,Skilled health personnel Annual Report 2015. Suva: Ministry of Health [Fiji]; 2016.,2025-04-07T06:46:44Z,2015,2015-01-01,2015-12-31
8697291,MDG_0000000025,COUNTRY,OMN,EMR,Eastern Mediterranean,YEAR,2016,,,,,,,,,99,99,,, Statistical year book 2019. Issue 47. Oman: National Centre for Statistics & Information; 2019.  ,2025-04-07T06:46:44Z,2016,2016-01-01,2016-12-31
8698927,MDG_0000000025,COUNTRY,MUS,AFR,Africa,YEAR,2010,,,,,,,,,100,100,,," Sustainable Development Goals  [online database]. Port Louis: Statistics Mauritius; 2020 (https://statsmauritius.govmu.org/Pages/Statistics/By_Subject/SDGs/SB_SDG.aspx, accessed 8 January 2021).",2025-04-07T06:46:44Z,2010,2010-01-01,2010-12-31
8701286,MDG_0000000025,COUNTRY,PHL,WPR,Western Pacific,YEAR,2000,,,,,,,,,58,58,,," Multiple Indicator Cluster Survey (MICS) Philippines 1999. Manila: National Statistics Office, United Nations Children’s Fund (UNICEF); 2001.",2025-04-07T06:46:44Z,2000,2000-01-01,2000-12-31
8707092,MDG_0000000025,REGION,EMR,,,YEAR,2021,,,,,,,,,80,80,,,,2024-04-26T13:59:03Z,2021,2021-01-01,2021-12-31
8720806,MDG_0000000025,REGION,EMR,,,YEAR,2008,,,,,,,,,58,58,,,,2025-04-07T06:46:44Z,2008,2008-01-01,2008-12-31
8724353,MDG_0000000025,COUNTRY,LBN,EMR,Eastern Mediterranean,YEAR,2000,,,,,,,,,100,100,,," National Perinatal Survey 1999-2000. Beirut: Ministry of Public Health [Lebanon], United Nations Children's Fund (UNICEF); 2001.",2025-04-07T06:46:44Z,1999-2000,1999-01-01,2000-12-31
8726700,MDG_0000000025,COUNTRY,AGO,AFR,Africa,YEAR,2016,,,,,,,,,50,50,,," Instituto Nacional de Estatística (INE), Ministério da Saúde (MINSA), Ministério do Planeamento e do Desenvolvimento Territorial (MINPLAN), ICF. Inquérito de Indicadores Múltiplos e de Saúde em Angola 2015-2016. Luanda, Angola e Rockville, Maryland, EUA: INE, MINSA, MINPLAN, ICF; 2017 (in Portuguese). ",2025-04-07T06:46:44Z,2015-2016,2015-01-01,2016-12-31
8728265,MDG_0000000025,COUNTRY,LCA,AMR,Americas,YEAR,2004,,,,,,,,,100,100,,,"Trained personnel Health Situation in the Americas: Basic Indicators 2006. Washington, DC: Pan American Health Organization/World Health Organization (PAHO/WHO), Health Analysis and Statistics Unit (HA); 2006.",2025-04-07T06:46:44Z,2004,2004-01-01,2004-12-31
8728441,MDG_0000000025,COUNTRY,TJK,EUR,Europe,YEAR,2004,,,,,,,,,75,75,,,"Skilled health personnel Transformative Monitoring for Enhanced Equity (TransMonEE) 2012 Database [online database]. Geneva: UNICEF Europe and Central Asia Regional Office; 2012 (www.transmonee.org, accessed 1 November 2012). ",2025-04-07T06:46:44Z,2004,2004-01-01,2004-12-31
8738068,MDG_0000000025,COUNTRY,MDV,SEAR,South-East Asia,YEAR,2012,,,,,,,,,96,96,,, The Maldives Health Statistics 2013. Malé: Ministry of Health [Republic of Maldives]; 2014.,2025-04-07T06:46:44Z,2012,2012-01-01,2012-12-31
8745940,MDG_0000000025,COUNTRY,BRN,WPR,Western Pacific,YEAR,2020,,,,,,,,,100,100,,,Skilled health personnel Ministry of Health [Brunei Darussalam]; 2022.,2025-04-07T06:46:44Z,2020,2020-01-01,2020-12-31
8746046,MDG_0000000025,COUNTRY,GEO,EUR,Europe,YEAR,2022,,,,,,,,,100,100,,,Skilled health personnel Electronic Registry for Maternal and Newborn Health (Birth Registry) Five year report 2018-2022,2025-04-07T06:46:44Z,2022,2022-01-01,2022-12-31
8746713,MDG_0000000025,COUNTRY,MLI,AFR,Africa,YEAR,2018,,,,,,,,,67,67,,,"Doctor, nurse/midwife, matrone Sixième Enquête Démographique et de Santé au
Mali 2018. Bamako, Rockville, Maryland: Institut National de la Statistique (INSTAT), Cellule de Planification et de Statistique Secteur Santé-Développement
Social et Promotion de la Famille (CPS/SS-DS-PF), ICF; 2019.",2025-04-07T06:46:44Z,2018,2018-01-01,2018-12-31
